{
  "segmentMergeRules": [
    {
      "pattern": [
        "z",
        "index"
      ],
      "combined": "z-index"
    },
    {
      "pattern": [
        "semi",
        "bold"
      ],
      "combined": "semi-bold"
    },
    {
      "pattern": [
        "extra",
        "bold"
      ],
      "combined": "extra-bold"
    },
    {
      "pattern": [
        "extra",
        "light"
      ],
      "combined": "extra-light"
    },
    {
      "pattern": [
        "screen",
        "reader"
      ],
      "combined": "screen-reader"
    },
    {
      "pattern": [
        "text",
        "transform"
      ],
      "combined": "text-transform"
    },
    {
      "pattern": [
        "line",
        "height"
      ],
      "combined": "line-height"
    },
    {
      "pattern": [
        "focus",
        "ring"
      ],
      "combined": "focus-ring"
    },
    {
      "pattern": [
        "font",
        "size"
      ],
      "combined": "font-size"
    },
    {
      "pattern": [
        "icon",
        "size"
      ],
      "combined": "icon-size"
    },
    {
      "pattern": [
        "padding",
        "x"
      ],
      "combined": "padding-x"
    },
    {
      "pattern": [
        "padding",
        "y"
      ],
      "combined": "padding-y"
    },
    {
      "pattern": [
        "empty",
        "state"
      ],
      "combined": "empty-state"
    },
    {
      "pattern": [
        "font",
        "weight"
      ],
      "combined": "font-weight"
    }
  ],
  "allowedSingleSegments": [
    "X",
    "Y",
    "Xs",
    "Xxs",
    "Sm",
    "Md",
    "Lg",
    "Xl",
    "Xl2",
    "Xl3",
    "Xl4",
    "Xxl",
    "Xxl2",
    "Xxl3"
  ],
  "stateSets": [
    {
      "manifestPath": [
        "component"
      ],
      "variants": [
        "Primary",
        "Secondary",
        "Tertiary",
        "Danger",
        "Warning",
        "Ghost"
      ],
      "properties": [
        {
          "name": "Background",
          "states": [
            "Base",
            "Hover",
            "Active",
            "Disabled"
          ]
        },
        {
          "name": "Text",
          "states": [
            "Base",
            "Disabled"
          ]
        },
        {
          "name": "Border",
          "states": [
            "Base",
            "Hover"
          ]
        },
        {
          "name": "Shadow",
          "states": [
            "Base"
          ]
        },
        {
          "name": "FocusRing",
          "states": [
            "Base"
          ]
        }
      ]
    }
  ],
  "manualVariables": [
    {
      "name": "--halo-badge-background",
      "aliasTarget": "--halo-badge-neutral-background"
    },
    {
      "name": "--halo-badge-border",
      "aliasTarget": "--halo-badge-neutral-border"
    },
    {
      "name": "--halo-badge-text-color",
      "aliasTarget": "--halo-badge-neutral-text"
    },
    {
      "name": "--halo-button-background",
      "aliasTarget": "--halo-button-secondary-background"
    },
    {
      "name": "--halo-button-background-active",
      "aliasTarget": "--halo-button-secondary-background-active"
    },
    {
      "name": "--halo-button-background-disabled",
      "aliasTarget": "--halo-button-secondary-background-disabled"
    },
    {
      "name": "--halo-button-background-hover",
      "aliasTarget": "--halo-button-secondary-background-hover"
    },
    {
      "name": "--halo-button-border",
      "aliasTarget": "--halo-button-secondary-border"
    },
    {
      "name": "--halo-button-border-disabled",
      "aliasTarget": "--halo-button-secondary-border"
    },
    {
      "name": "--halo-button-border-hover",
      "aliasTarget": "--halo-button-secondary-border-hover"
    },
    {
      "name": "--halo-button-focus-ring",
      "aliasTarget": "--halo-button-secondary-focus-ring"
    },
    {
      "name": "--halo-button-font-size",
      "aliasTarget": "--halo-button-size-md-font-size"
    },
    {
      "name": "--halo-button-gap",
      "aliasTarget": "--halo-button-size-md-gap"
    },
    {
      "name": "--halo-button-height",
      "aliasTarget": "--halo-button-size-md-height"
    },
    {
      "name": "--halo-button-icon-size",
      "aliasTarget": "--halo-button-size-md-icon-size"
    },
    {
      "name": "--halo-button-padding-x",
      "aliasTarget": "--halo-button-size-md-padding-x"
    },
    {
      "name": "--halo-button-padding-y",
      "aliasTarget": "--halo-button-size-md-padding-y"
    },
    {
      "name": "--halo-button-shadow",
      "aliasTarget": "--halo-button-secondary-shadow"
    },
    {
      "name": "--halo-button-text-color",
      "aliasTarget": "--halo-button-secondary-text"
    },
    {
      "name": "--halo-button-text-disabled",
      "aliasTarget": "--halo-button-secondary-text-disabled"
    },
    {
      "name": "--halo-expandable-panel-content-expanded-height",
      "aliasTarget": null
    },
    {
      "name": "--halo-input-size-lg-gap",
      "aliasTarget": null
    },
    {
      "name": "--halo-input-size-md-gap",
      "aliasTarget": null
    },
    {
      "name": "--halo-input-size-sm-gap",
      "aliasTarget": null
    },
    {
      "name": "--halo-label-color",
      "aliasTarget": "--halo-label-primary-text"
    },
    {
      "name": "--halo-label-font-size",
      "aliasTarget": "--halo-label-size-md-font-size"
    },
    {
      "name": "--halo-label-gap",
      "aliasTarget": "--halo-label-size-md-gap"
    },
    {
      "name": "--halo-label-icon-color",
      "aliasTarget": "--halo-label-primary-icon"
    },
    {
      "name": "--halo-label-icon-size",
      "aliasTarget": "--halo-label-size-md-icon-size"
    },
    {
      "name": "--halo-label-indicator-color",
      "aliasTarget": "--halo-label-primary-indicator"
    },
    {
      "name": "--halo-label-letter-spacing",
      "aliasTarget": "--halo-label-size-md-letter-spacing"
    },
    {
      "name": "--halo-label-line-height",
      "aliasTarget": "--halo-label-size-md-line-height"
    },
    {
      "name": "--halo-label-optional-color",
      "aliasTarget": "--halo-label-indicators-optional-color"
    },
    {
      "name": "--halo-label-optional-weight",
      "aliasTarget": null
    },
    {
      "name": "--halo-label-required-color",
      "aliasTarget": "--halo-label-indicators-required-color"
    },
    {
      "name": "--halo-label-text-transform",
      "aliasTarget": "--halo-label-size-md-text-transform"
    },
    {
      "name": "--halo-label-weight-bold",
      "aliasTarget": "--halo-label-weights-bold"
    },
    {
      "name": "--halo-label-weight-medium",
      "aliasTarget": "--halo-label-weights-medium"
    },
    {
      "name": "--halo-label-weight-regular",
      "aliasTarget": "--halo-label-weights-regular"
    },
    {
      "name": "--halo-label-weight-semibold",
      "aliasTarget": "--halo-label-weights-semi-bold"
    },
    {
      "name": "--halo-select-option-gap",
      "aliasTarget": null
    },
    {
      "name": "--halo-select-option-padding-x",
      "aliasTarget": null
    },
    {
      "name": "--halo-select-option-padding-y",
      "aliasTarget": null
    },
    {
      "name": "--halo-select-size-font-size",
      "aliasTarget": "--halo-select-trigger-size-md-font-size"
    },
    {
      "name": "--halo-select-size-gap",
      "aliasTarget": null
    },
    {
      "name": "--halo-select-size-height",
      "aliasTarget": "--halo-select-trigger-size-md-height"
    },
    {
      "name": "--halo-select-size-padding-x",
      "aliasTarget": "--halo-select-trigger-size-md-padding-x"
    },
    {
      "name": "--halo-select-size-padding-y",
      "aliasTarget": "--halo-select-trigger-size-md-padding-y"
    },
    {
      "name": "--halo-select-transition",
      "aliasTarget": "--halo-select-trigger-transition"
    },
    {
      "name": "--halo-select-trigger-size-lg-gap",
      "aliasTarget": null
    },
    {
      "name": "--halo-select-trigger-size-md-gap",
      "aliasTarget": null
    },
    {
      "name": "--halo-select-trigger-size-sm-gap",
      "aliasTarget": null
    },
    {
      "name": "--halo-table-filter-button-background",
      "aliasTarget": "--halo-color-interactive-secondary"
    },
    {
      "name": "--halo-table-filter-button-border",
      "aliasTarget": "--halo-color-interactive-primary"
    },
    {
      "name": "--halo-table-filter-button-focus",
      "aliasTarget": "--halo-color-border-focus"
    },
    {
      "name": "--halo-table-filter-button-hover",
      "aliasTarget": "--halo-color-interactive-secondary-hover"
    },
    {
      "name": "--halo-table-filter-button-text",
      "aliasTarget": "--halo-color-interactive-primary"
    },
    {
      "name": "--halo-table-filter-chip-background",
      "aliasTarget": "--halo-color-interactive-secondary"
    },
    {
      "name": "--halo-table-filter-chip-border",
      "aliasTarget": "--halo-color-border-default"
    },
    {
      "name": "--halo-table-filter-chip-icon",
      "aliasTarget": "--halo-color-text-link"
    },
    {
      "name": "--halo-table-filter-chip-text",
      "aliasTarget": "--halo-color-text-link"
    },
    {
      "name": "--halo-table-filter-panel-background",
      "aliasTarget": "--halo-color-surface-subdued"
    },
    {
      "name": "--halo-table-filter-panel-border",
      "aliasTarget": "--halo-color-border-subtle"
    },
    {
      "name": "--halo-table-filter-panel-text",
      "aliasTarget": "--halo-color-text-secondary"
    },
    {
      "name": "--halo-table-header-border",
      "aliasTarget": "--halo-table-header-border-bottom"
    },
    {
      "name": "--halo-table-header-padding-x",
      "aliasTarget": null
    },
    {
      "name": "--halo-table-header-padding-y",
      "aliasTarget": null
    },
    {
      "name": "--halo-table-mobile-card-background",
      "aliasTarget": "--halo-color-surface-default"
    },
    {
      "name": "--halo-table-mobile-card-border",
      "aliasTarget": "--halo-color-border-subtle"
    },
    {